objectid,filename,title,creator,contributor,date,description,medium,deminsions,subject,source,identifier,format,rights,rightsstatement
PAT001,pat001.pdf,Half Moon-Demi Lune,DMC,None,2018,Cross stitch pattern of a half moon and stars overlaying a sunburst. Colors are shades of gold and silver.,14ct;Aida Fabric;DMC thread,"7.28""x7.28""",Stars;Sun;Moon;Gold;Silver,https://www.dmc.com/us/half-moon--pattern-9006046.html,PAT001,application/pdf,Content offered on the website are original creations protected by copyright. Reproduction is strictly prohibited for other purposes than personal and private non-commercial use.,https://rightsstatements.org/page/InC-NC/1.0/?language=en
PAT002,pat003.pdf,Christmas Sampler,DMC,None,2019,"Christmas pattern of three layers. First layer has snoflakes and ornaments, then reindeer and stars and finally christmas trees and stars. Has Merry Christmas along the bottom. Main colors are green, gold, silver and red.",11ct;Aida Fabric;DMC thread,"9.21""x9.03""",Christmas;star;tree;reindeer;merry christmas,https://www.dmc.com/us/christmas-sampler-pattern-9008094.html,PAT002,application/pdf,Content offered on the website are original creations protected by copyright. Reproduction is strictly prohibited for other purposes than personal and private non-commercial use.,https://rightsstatements.org/page/InC-NC/1.0/?language=en
PAT003,pat003.pdf,Heart,DMC,none,2019,A stylized heart with vines and flowers twined inside of it. Gold is the main color used.,11ct;Aida Fabric;DMC thread,"8.41""x9.03""",Heart;vines;flower;gold,https://www.dmc.com/us/heart-pattern-9008096.html,PAT003,application/pdf,Content offered on the website are original creations protected by copyright. Reproduction is strictly prohibited for other purposes than personal and private non-commercial use.,https://rightsstatements.org/page/InC-NC/1.0/?language=en
PAT004,pat004.pdf,Moonlit Owl,Ryann(Wild Violet Cross Stich),none,2022,A small circular pattern with a half moon and owl sitting on a branch. Done entirely in yellow or gold. Best on a dark or black fabric.,14ct; Aida Fabric; 28ct; Evenweave Fabric; DMC thread,"3""x3""",owl;moon;circle;gold;yellow,https://www.wildviolet.co/patterns/moonlit-owl?utm_source=Gumroad&utm_medium=email&utm_campaign=owl+launch&d=1,PAT004,application/pdf,"Pattern offered for free use on Designer's website, no other copyright statements are made.",https://rightsstatements.org/page/InC/1.0/?language=en
PAT005,pat005.pdf,Cauldron Thread Organizer Pillow,Ryann(Wild Violet Cross Stich),none,2022,A pillow with plastic rings for organizing the threads of a project. Has a pocket to tuck to the thread into once secured to the rings. The pocket has a witch like cauldron stiched on it. Yellow and green and grays are the main colors.,18ct; Aida Fabric; 36ct; Evenweave Fabric; DMC thread,"5""x5""",witch;halloween;pillow;thread organizer;cauldron;yellow;gray,https://www.wildviolet.co/patterns/cauldron-thread-organizer-pillow?utm_source=Gumroad&utm_medium=email&utm_campaign=cauldron+launch&d=1,PAT005,application/pdf,"Pattern offered for free use on Designer's website, no other copyright statements are made.",https://rightsstatements.org/page/InC/1.0/?language=en
PAT006,pat006.pdf,Moonlit Cat,Ryann(Wild Violet Cross Stich),none,2022,"A simple cat with an archway and half moon with stars. Black thread only, light background.",14ct; Aida Fabric;28ct; Evenweave Fabric;DMC thread,"3""x3""",Cat;moon;stars;black,https://www.wildviolet.co/patterns/moonlit-cat?utm_source=Gumroad&utm_medium=email&utm_campaign=moonlit+cat+launch&d=1,PAT006,application/pdf,"Pattern offered for free use on Designer's website, no other copyright statements are made.",https://rightsstatements.org/page/InC/1.0/?language=en
PAT007,pat007.pdf,Fox And Crow,Ryann(Wild Violet Cross Stich),none,2022,"A fox and crow in black. Half moon, stars and flowers. Colors are black, silver and gold.",18ct; Aida Fabric; 36ct; Evenweave Fabric; DMC threads,"3.4""x3.4""",Fox;crow;stars;moon;flower,https://www.wildviolet.co/patterns/fox-and-crow?utm_source=Gumroad&utm_medium=email&utm_campaign=fox+crow+launch&d=1,PAT007,application/pdf,"Pattern offered for free use on Designer's website, no other copyright statements are made.",https://rightsstatements.org/page/InC/1.0/?language=en
PAT008,pat008.pdf,Untitled Bookmark,beaeaeae,None,2022,"An original bookmark pattern, designed using backstitch. Uses black thread but can be subsistuted with different colors.",backstitch;14ct;18ct;Aida Fabric,"14""x4""",bookmark;black;flower,https://www.reddit.com/r/CrossStitch/comments/skh7hm/pic_heres_the_pattern_to_the_blackwork_bookmark_i/,PAT008,image/jpg,Public Domain; Feel free to use the pattern in any way you’d like,https://creativecommons.org/share-your-work/public-domain/cc0/
PAT009,pat009.pdf,Blood Moth,NightSpiritStudio,none,2022,"Original pattern based on a Lunar Moth, with red and silver designs. Chain link framing. Reccomended on 14ct with black fabric.",14ct; 16ct; 18ct; Aida Fabric;DMC thread,"9""x9"";7 3/4""x7 3/4""; 7""x7""",moth;Halloween;red;black,https://www.nightspiritstudio.com/freebies,PAT009,application/pdf,"This Pattern is Provided For Free. It may be Shared, but only in full. Do not remove watermarks, logos or pages. Do not sell this pattern...",https://rightsstatements.org/page/InC-NC/1.0/?language=en
PAT010,pat010.pdf,Dumpster English,NightSpiritStudio,none,2022,"An original pattern of a dumpster on fire with the phrase ""That's Life"" in an arch above the dumpster outlines in orange and red. Full color.",14ct; Aida Fabric;DMC threads,"8""x8""",dumpster;fire;orange;red,https://www.nightspiritstudio.com/freebies,PAT010,application/pdf,"Pattern offered for free use on Designer's website, no other copyright statements are made.",https://rightsstatements.org/page/InC-NC/1.0/?language=en
PAT011,pat011.pdf,Black Cat,thatflossboss,none,2019,A plain design of a full stylized black cat. Black thread and backstitching,backstitch;14ct; Aida Fabric; DMC thread,"3.14""x3.79""",cat;black,https://www.reddit.com/r/CrossStitch/comments/d9haku/pattern_hey_made_a_little_freebie_cat_not_really/,PAT011,application/pdf,Public Domain,https://creativecommons.org/share-your-work/public-domain/cc0/
PAT012,pat012.pdf,Okami pattern,Awenmir,Clover Studios,2019,"A bookmark of the main character of the Okami games. A giant stylized wolf. Main color is white, the character is fully colored.",backstitch; 22ct; Aida Fabric; DMC thread,6.35x19.05 cm,bookmark;okami;white;wolf,https://hwood7.wixsite.com/superstitch/miscellaneous,PAT012,application/pdf,"All the patterns on this website are fan-made and free.  All characters and rights etc. belong to the original creators.  Please do not sell these patterns.

",https://rightsstatements.org/page/InC/1.0/?language=en
PAT013,pat013.pdf,P5 Take Your Heart Logo,Awenmir,P-Studio,2019,"The logo of the video Persona 5. Has the icon of the main character and the phrase ""Take your heart"". Fully colored in red, black and grays. Reccomended on black fabric.",14ct;16ct;18ct; Aida Fabric;DMC threads,17x17 cm;15x15 cm;13x13 cm,Persona;video game;red;black,https://hwood7.wixsite.com/superstitch/miscellaneous,PAT013,application/pdf,"All the patterns on this website are fan-made and free.  All characters and rights etc. belong to the original creators.  Please do not sell these patterns.

",https://rightsstatements.org/page/InC/1.0/?language=en
PAT014,pat014.jpeg,Save Your Progress?,tamgui,none,2019,"A bookmark of the phrase ""Save your progress?"" with the choices Yes and No and the icon of a 90's floppy disc. Green or white thread on a black fabric.",14ct; 22ct; Aida Fabric,Unknown,computer;bookmark;green;black;white,https://imgur.com/gallery/0gJBPUn,PAT014,image/jpeg,Public Domain,https://creativecommons.org/share-your-work/public-domain/cc0/
PAT015,pat015.jpeg,Taco,"Davidson, Sarah",none,2019,A pattern made for a specific series of hand bag found at Target. A fully colored smiling taco. Yellow is the main colors.,Target Make-up Bag;DMC thread,Unknown,target bag;taco;yellow;,https://imgur.com/gallery/kbd6gbc,PAT015,image/jpeg,"Public Domain; The blank template and these ten patterns are free, feel free to use them however you like!",https://creativecommons.org/share-your-work/public-domain/cc0/
PAT016,pat016.jpeg,D.va Pixel Bunny,JackOfAllThreads,Blizzard,2019,A simple pattern that is a conversion of a character's spray. The spray is a pink Bunny with GG under it. This belongs to the character D.va from the game Overwatch. Main colors are pink and white.,14ct;16ct;Aida Fabric;Unknown Thread,unknown,overwatch;bunny;pink;white;video game;d.va,https://www.reddit.com/r/Overwatch/comments/as000h/i_converted_all_of_the_overwatch_pixel_sprays/?utm_source=reddit-android,PAT016,image/png,Free to use pattern created using assets from a third party company.,https://rightsstatements.org/page/InC/1.0/?language=en
PAT017,pat017.pdf,Key to My Heart Stained Glass,Ryann(Wild Violet Cross Stich),none,2022,A valentine's day pattern. An arched stained glass window with a heart and a key in the panes. Shades of pink and black are the main colors.,14ct; Aida Fabric; 28ct; Evenweave Fabric; DMC thread,"3.5""x4.7""",Valentine's day;heart;key;stained glass;black;pink,https://www.wildviolet.co/patterns/key-to-my-heart-stained-glass?utm_source=Reddit&utm_medium=social&utm_campaign=new-sidebar&d=1,PAT017,application/pdf,"Pattern offered for free use on Designer's website, no other copyright statements are made.",https://rightsstatements.org/page/InC-RUU/1.0/?language=en
PAT018,pat018.pdf,Thanks-A-Latte,"Radzin, Stephanie (Little Lion Stitchery)",none,2021,A small simple pattern of a heart done i the style of latte art. Best on a light brown background. Uses white thread.,14ct;28ct;Aida Fabric;DMC thread,"Unknown; Fits in 3"" hoop",heart;coffee;Valentine's day;white;hoop art;,https://littlelionstitchery.com/freebies/,PAT018,application/pdf,"Pattern offered for free use on Designer's website, no other copyright statements are made.",https://rightsstatements.org/page/InC-NC/1.0/?language=en
PAT019,pat019.pdf,You Complete Me,PixStitchCanada,The Tetris Company,2022,A tetris inspired pattern of a heart. Uses shades of red and pink with black outlining. Three strands per color.,14ct;16ct;18ct;20ct;Aida Fabric;DMC thread,"7.6""x8.2"";6.7""x7.2"";5.9""x6.4"";5.3""x5.8""",heart;Valentine's day;Tetris;video game;red;pink;,https://drive.google.com/file/d/1kp_DY0SE0I8Du55RVA4VfDqAKQBM5fdA/view,PAT019,application/pdf,"Fair Use of third party assests to create an original pattern. Recieved permisson from copyright holder. ; Get creative! Add letters to make it a wedding or anniversary piece or add a phrase to show someone you love them. Want to change the colours? Do it! Have fun!

This pattern is free to the community",https://rightsstatements.org/page/InC/1.0/?language=en; 
PAT020,pat020.pdf,Haunted Teired Cake,The Witchy Stitcher,none,2021,"A four tire cake pattern with halloween decorations. Shades of black, gray and orange. Backstitching. Reccomended to use gray fabric.",backstitch; 14ct; Aida Fabric;DMC thread,"3.36""x8.36""",cake;Halloween;orange;black,https://www.thewitchystitcher.com/freebies,PAT020,application/pdf,"Pattern offered for free use on Designer's website, no other copyright statements are made.",https://rightsstatements.org/page/InC-NC/1.0/?language=en
PAT021,pat021.pdf,This Is Boo Sheet,The Witchy Stitcher,none,2020,"Small pattern that features and unhappy looking ghost with the phrase 'This is Boo Sheet' at the bottom.White is the main color, reccommended on a gray fabric.",14ct;Aida Fabric;DMC Thread,"2.43""x5.50""",ghost;halloween;white;,https://www.thewitchystitcher.com/freebies,PAT021,application/pdf,"Pattern offered for free use on Designer's website, no other copyright statements are made.",https://rightsstatements.org/page/InC-NC/1.0/?language=en
PAT022,pat022.pdf,Angel of Autumn,"Winston, Lois",none,2004,A fully colorized angel in shades of browns and golds. There is also a squirrel next to her dress. Reccommended on Oatmeal fiddler's cloth.,backstitch;14ct;Oatmeal Fiddler's Cloth;Anchor thread;DMC thread,"10""x12""",angel;squirrel;autumn,www.kreinik.com,PAT022,application/pdf,"Kreinik.com grants you a limited license to access and make personal use of this site. This site or any portion of this site may not be reproduced, duplicated, copied, sold, resold, visited, or otherwise exploited for any commercial purpose without express written consent of Kreinik.com.",https://rightsstatements.org/page/InC-NC/1.0/?language=en
PAT023,pat023.pdf,Easter Basket Bookmark,"Kellogg, Pam",none,unknown,A bookmark using spring themes. Features a basket with stylized shapes and purple flowers. White fabric reccommended.,backstitch;24ct; stitchband fabric; Kreinik Silk Mori thread,"2""x8""",Easter;spring;bookmark;flower;basket,www.kreinik.com,PAT023,application/pdf,"Kreinik.com grants you a limited license to access and make personal use of this site. This site or any portion of this site may not be reproduced, duplicated, copied, sold, resold, visited, or otherwise exploited for any commercial purpose without express written consent of Kreinik.com.",https://rightsstatements.org/page/InC-NC/1.0/?language=en
PAT024,pat024.pdf,Pink Buds,"Dixon, Judy",none,2012,"A square panel cross stitch. Featuring a pink flower in the center, pink bordering and white border flowers with green leaves. A spring design. Reccommend cream linen. Backstitching.",backstitch;32ct; linen;Kreinik Silk Mori thread,"2 3/4""x 2 3/4""",spring;flower;pink,www.kreinik.com,PAT024,application/pdf,"Kreinik.com grants you a limited license to access and make personal use of this site. This site or any portion of this site may not be reproduced, duplicated, copied, sold, resold, visited, or otherwise exploited for any commercial purpose without express written consent of Kreinik.com.",https://rightsstatements.org/page/InC-NC/1.0/?language=en
PAT025,pat025.png,Ashe and Bob Pixel Spray Graph,JackOfAllThreads,Blizzard,2019,A conversion of pixel art in the game overwatch. Depicts two characters Ashe and Bob. Main colors are gray and shades of brown.,14ct; 16ct; Aida Fabric; Unknown thread,Unknown,overwatch;Ashe;Bob;gray;video game;,https://www.reddit.com/r/Overwatch/comments/arzsr9/i_converted_all_of_the_overwatch_pixel_sprays/,PAT025,image/png,Fair Use of third party assets to create a conversion pattern,https://rightsstatements.org/page/InC/1.0/?language=en